{
  "Id": 1934,
  "Url": null,
  "Timestamp": "2026-05-03",
  "Contact": null,
  "FirstName": "Jane Smith",
  "LastName": "Jane Smith",
  "Organization": "example-value",
  "Email": "member@example.com",
  "Message": "example-value",
  "Severity": "Warning",
  "OrderType": "ChangeBillingInfo",
  "Properties": {},
  "Document": null,
  "DocumentType": "Adjustment",
  "DocumentAction": "Created"
}